{"version":1,"routing_backend":"NativeCpuBackend","routing_reason":"gpu-auto-fallback-cpu","sidecar_used":false,"requested_gpu_device_ids":[0],"routing_gpu_device_ids":[],"query":"ERROR","path":"C:\\example\\project\\gpu_cpu_fallback","total_matches":1,"matches":[{"file":"C:\\example\\project\\gpu_cpu_fallback\\probe.log","line":1,"text":"ERROR gpu probe"}]}
