{"version":1,"routing_backend":"TrigramIndex","routing_reason":"index-accelerated","sidecar_used":false,"requested_gpu_device_ids":[],"routing_gpu_device_ids":[],"query":"ERROR","path":"C:\\example\\project\\search_index","total_matches":2,"matches":[{"file":"C:\\example\\project\\search_index\\sample_a.log","line":2,"text":"ERROR database failed"},{"file":"C:\\example\\project\\search_index\\sample_b.log","line":2,"text":"ERROR database failed"}]}
