{"version":1,"routing_backend":"CpuBackend","routing_reason":"cpu-native","sidecar_used":false,"requested_gpu_device_ids":[],"routing_gpu_device_ids":[],"query":"ERROR","path":"C:\\example\\project\\search_cpu","total_matches":2,"matches":[{"file":"C:\\example\\project\\search_cpu\\sample_a.log","line":2,"text":"ERROR database failed"},{"file":"C:\\example\\project\\search_cpu\\sample_b.log","line":2,"text":"ERROR database failed"}]}
