{"version":1,"routing_backend":"CpuBackend","routing_reason":"cpu-native","sidecar_used":false,"requested_gpu_device_ids":[],"routing_gpu_device_ids":[],"query":"ERROR","path":"C:\\dev\\projects\\tensor-grep\\bench_data\\harness_api_doc_inputs\\search_cpu","total_matches":2,"matches":[{"file":"C:\\dev\\projects\\tensor-grep\\bench_data\\harness_api_doc_inputs\\search_cpu\\sample_a.log","line":2,"text":"ERROR database failed"},{"file":"C:\\dev\\projects\\tensor-grep\\bench_data\\harness_api_doc_inputs\\search_cpu\\sample_b.log","line":2,"text":"ERROR database failed"}]}
